{"schema":"csl.eval.result/v0.1","query_id":"lookup-first","snapshot":"S0","entities":[1],"propositions":[{"proposition":3461,"subject":1,"relation":"CALLS","object":263,"polarity":"POSITIVE","quality":"EXACT","freshness_epoch":1,"lineage":4},{"proposition":1075,"subject":1,"relation":"CONTAINS","object":145,"polarity":"POSITIVE","quality":"EXACT","freshness_epoch":1,"lineage":2},{"proposition":535,"subject":1,"relation":"CONTAINS","object":895,"polarity":"POSITIVE","quality":"EXACT","freshness_epoch":1,"lineage":6},{"proposition":4809,"subject":1,"relation":"OVERRIDES","object":109,"polarity":"POSITIVE","quality":"EXACT","freshness_epoch":1,"lineage":0},{"proposition":1864,"subject":1,"relation":"OVERRIDES","object":265,"polarity":"POSITIVE","quality":"EXACT","freshness_epoch":1,"lineage":7},{"proposition":4832,"subject":1,"relation":"REFERENCES","object":642,"polarity":"POSITIVE","quality":"EXACT","freshness_epoch":1,"lineage":7},{"proposition":2870,"subject":165,"relation":"CONTAINS","object":1,"polarity":"POSITIVE","quality":"EXACT","freshness_epoch":1,"lineage":5},{"proposition":3939,"subject":264,"relation":"OVERRIDES","object":1,"polarity":"POSITIVE","quality":"EXACT","freshness_epoch":1,"lineage":2},{"proposition":2164,"subject":514,"relation":"OVERRIDES","object":1,"polarity":"POSITIVE","quality":"EXACT","freshness_epoch":1,"lineage":3},{"proposition":3837,"subject":607,"relation":"REFERENCES","object":1,"polarity":"POSITIVE","quality":"EXACT","freshness_epoch":1,"lineage":4},{"proposition":49,"subject":908,"relation":"OVERRIDES","object":1,"polarity":"POSITIVE","quality":"EXACT","freshness_epoch":1,"lineage":0}],"knowledge":{"model":"open-world"},"completeness":{"entity_set":"OBSERVED"},"digest":"sha256:7dfae43129952c257e02b6573e4e6f2a5a204b1eb13eef0df02586afe1933aa0"}