{"schema":"csl.eval.result/v0.1","query_id":"incoming","snapshot":"S0","entities":[165,264,514,607,908],"propositions":[{"proposition":3690,"subject":20,"relation":"CONTAINS","object":165,"polarity":"POSITIVE","quality":"EXACT","freshness_epoch":1,"lineage":1},{"proposition":4722,"subject":27,"relation":"REFERENCES","object":607,"polarity":"POSITIVE","quality":"EXACT","freshness_epoch":1,"lineage":1},{"proposition":2534,"subject":48,"relation":"OVERRIDES","object":264,"polarity":"POSITIVE","quality":"EXACT","freshness_epoch":1,"lineage":5},{"proposition":364,"subject":107,"relation":"OVERRIDES","object":514,"polarity":"POSITIVE","quality":"EXACT","freshness_epoch":1,"lineage":3},{"proposition":738,"subject":132,"relation":"IMPLEMENTS","object":165,"polarity":"POSITIVE","quality":"EXACT","freshness_epoch":1,"lineage":1},{"proposition":3801,"subject":138,"relation":"CALLS","object":607,"polarity":"POSITIVE","quality":"EXACT","freshness_epoch":1,"lineage":0},{"proposition":878,"subject":144,"relation":"IMPLEMENTS","object":165,"polarity":"POSITIVE","quality":"EXACT","freshness_epoch":1,"lineage":5},{"proposition":4443,"subject":147,"relation":"IMPLEMENTS","object":607,"polarity":"POSITIVE","quality":"EXACT","freshness_epoch":1,"lineage":2},{"proposition":4256,"subject":165,"relation":"CALLS","object":244,"polarity":"POSITIVE","quality":"EXACT","freshness_epoch":1,"lineage":7},{"proposition":2870,"subject":165,"relation":"CONTAINS","object":1,"polarity":"POSITIVE","quality":"EXACT","freshness_epoch":1,"lineage":5},{"proposition":4630,"subject":165,"relation":"CONTAINS","object":396,"polarity":"POSITIVE","quality":"EXACT","freshness_epoch":1,"lineage":5},{"proposition":2218,"subject":165,"relation":"IMPLEMENTS","object":450,"polarity":"POSITIVE","quality":"EXACT","freshness_epoch":1,"lineage":1},{"proposition":1799,"subject":229,"relation":"OVERRIDES","object":908,"polarity":"POSITIVE","quality":"EXACT","freshness_epoch":1,"lineage":6},{"proposition":4816,"subject":247,"relation":"CALLS","object":165,"polarity":"POSITIVE","quality":"EXACT","freshness_epoch":1,"lineage":7},{"proposition":3953,"subject":254,"relation":"IMPLEMENTS","object":607,"polarity":"POSITIVE","quality":"EXACT","freshness_epoch":1,"lineage":0},{"proposition":2346,"subject":264,"relation":"CALLS","object":190,"polarity":"POSITIVE","quality":"EXACT","freshness_epoch":1,"lineage":1},{"proposition":1251,"subject":264,"relation":"CALLS","object":303,"polarity":"POSITIVE","quality":"EXACT","freshness_epoch":1,"lineage":2},{"proposition":2515,"subject":264,"relation":"CONTAINS","object":197,"polarity":"POSITIVE","quality":"EXACT","freshness_epoch":1,"lineage":2},{"proposition":3580,"subject":264,"relation":"CONTAINS","object":227,"polarity":"POSITIVE","quality":"EXACT","freshness_epoch":1,"lineage":3},{"proposition":3393,"subject":264,"relation":"IMPLEMENTS","object":552,"polarity":"POSITIVE","quality":"EXACT","freshness_epoch":1,"lineage":0},{"proposition":3939,"subject":264,"relation":"OVERRIDES","object":1,"polarity":"POSITIVE","quality":"EXACT","freshness_epoch":1,"lineage":2},{"proposition":544,"subject":264,"relation":"OVERRIDES","object":712,"polarity":"POSITIVE","quality":"EXACT","freshness_epoch":1,"lineage":7},{"proposition":2869,"subject":264,"relation":"OVERRIDES","object":871,"polarity":"POSITIVE","quality":"EXACT","freshness_epoch":1,"lineage":4},{"proposition":1902,"subject":264,"relation":"REFERENCES","object":331,"polarity":"POSITIVE","quality":"EXACT","freshness_epoch":1,"lineage":5},{"proposition":1357,"subject":264,"relation":"REFERENCES","object":470,"polarity":"POSITIVE","quality":"EXACT","freshness_epoch":1,"lineage":4},{"proposition":3986,"subject":307,"relation":"CALLS","object":264,"polarity":"POSITIVE","quality":"EXACT","freshness_epoch":1,"lineage":1},{"proposition":2063,"subject":428,"relation":"IMPLEMENTS","object":264,"polarity":"POSITIVE","quality":"EXACT","freshness_epoch":1,"lineage":6},{"proposition":4386,"subject":495,"relation":"CALLS","object":514,"polarity":"POSITIVE","quality":"EXACT","freshness_epoch":1,"lineage":1},{"proposition":2166,"subject":514,"relation":"CALLS","object":368,"polarity":"POSITIVE","quality":"EXACT","freshness_epoch":1,"lineage":5},{"proposition":1726,"subject":514,"relation":"CALLS","object":554,"polarity":"POSITIVE","quality":"EXACT","freshness_epoch":1,"lineage":5},{"proposition":1671,"subject":514,"relation":"CALLS","object":1000,"polarity":"POSITIVE","quality":"EXACT","freshness_epoch":1,"lineage":6},{"proposition":3048,"subject":514,"relation":"IMPLEMENTS","object":974,"polarity":"POSITIVE","quality":"EXACT","freshness_epoch":1,"lineage":7},{"proposition":2164,"subject":514,"relation":"OVERRIDES","object":1,"polarity":"POSITIVE","quality":"EXACT","freshness_epoch":1,"lineage":3},{"proposition":407,"subject":514,"relation":"REFERENCES","object":363,"polarity":"POSITIVE","quality":"EXACT","freshness_epoch":1,"lineage":6},{"proposition":652,"subject":514,"relation":"REFERENCES","object":452,"polarity":"POSITIVE","quality":"EXACT","freshness_epoch":1,"lineage":3},{"proposition":302,"subject":514,"relation":"REFERENCES","object":958,"polarity":"POSITIVE","quality":"EXACT","freshness_epoch":1,"lineage":5},{"proposition":793,"subject":537,"relation":"IMPLEMENTS","object":264,"polarity":"POSITIVE","quality":"EXACT","freshness_epoch":1,"lineage":0},{"proposition":4388,"subject":578,"relation":"IMPLEMENTS","object":514,"polarity":"POSITIVE","quality":"EXACT","freshness_epoch":1,"lineage":3},{"proposition":4151,"subject":607,"relation":"CALLS","object":601,"polarity":"POSITIVE","quality":"EXACT","freshness_epoch":1,"lineage":6},{"proposition":3473,"subject":607,"relation":"IMPLEMENTS","object":73,"polarity":"POSITIVE","quality":"EXACT","freshness_epoch":1,"lineage":0},{"proposition":4073,"subject":607,"relation":"IMPLEMENTS","object":187,"polarity":"POSITIVE","quality":"EXACT","freshness_epoch":1,"lineage":0},{"proposition":1408,"subject":607,"relation":"IMPLEMENTS","object":295,"polarity":"POSITIVE","quality":"EXACT","freshness_epoch":1,"lineage":7},{"proposition":179,"subject":607,"relation":"OVERRIDES","object":588,"polarity":"POSITIVE","quality":"EXACT","freshness_epoch":1,"lineage":2},{"proposition":3837,"subject":607,"relation":"REFERENCES","object":1,"polarity":"POSITIVE","quality":"EXACT","freshness_epoch":1,"lineage":4},{"proposition":849,"subject":639,"relation":"OVERRIDES","object":264,"polarity":"POSITIVE","quality":"EXACT","freshness_epoch":1,"lineage":0},{"proposition":4065,"subject":647,"relation":"CONTAINS","object":264,"polarity":"POSITIVE","quality":"EXACT","freshness_epoch":1,"lineage":0},{"proposition":2972,"subject":726,"relation":"REFERENCES","object":264,"polarity":"POSITIVE","quality":"EXACT","freshness_epoch":1,"lineage":3},{"proposition":2968,"subject":789,"relation":"IMPLEMENTS","object":514,"polarity":"POSITIVE","quality":"EXACT","freshness_epoch":1,"lineage":7},{"proposition":397,"subject":802,"relation":"REFERENCES","object":514,"polarity":"POSITIVE","quality":"EXACT","freshness_epoch":1,"lineage":4},{"proposition":2838,"subject":818,"relation":"IMPLEMENTS","object":514,"polarity":"POSITIVE","quality":"EXACT","freshness_epoch":1,"lineage":5},{"proposition":3111,"subject":908,"relation":"CALLS","object":24,"polarity":"POSITIVE","quality":"EXACT","freshness_epoch":1,"lineage":6},{"proposition":81,"subject":908,"relation":"CALLS","object":163,"polarity":"POSITIVE","quality":"EXACT","freshness_epoch":1,"lineage":0},{"proposition":1221,"subject":908,"relation":"CALLS","object":173,"polarity":"POSITIVE","quality":"EXACT","freshness_epoch":1,"lineage":4},{"proposition":3870,"subject":908,"relation":"CONTAINS","object":456,"polarity":"POSITIVE","quality":"EXACT","freshness_epoch":1,"lineage":5},{"proposition":3455,"subject":908,"relation":"CONTAINS","object":547,"polarity":"POSITIVE","quality":"EXACT","freshness_epoch":1,"lineage":6},{"proposition":3673,"subject":908,"relation":"IMPLEMENTS","object":664,"polarity":"POSITIVE","quality":"EXACT","freshness_epoch":1,"lineage":0},{"proposition":313,"subject":908,"relation":"IMPLEMENTS","object":755,"polarity":"POSITIVE","quality":"EXACT","freshness_epoch":1,"lineage":0},{"proposition":49,"subject":908,"relation":"OVERRIDES","object":1,"polarity":"POSITIVE","quality":"EXACT","freshness_epoch":1,"lineage":0},{"proposition":4248,"subject":928,"relation":"IMPLEMENTS","object":514,"polarity":"POSITIVE","quality":"EXACT","freshness_epoch":1,"lineage":7}],"knowledge":{"model":"open-world"},"completeness":{"entity_set":"OBSERVED"},"digest":"sha256:eff84a0b235c97d52e25935fcaa43b8f97be65da6f8a6690af9994a87ea756c6"}